{
  "profile": "3gpp-27007-r18",
  "source": "references/snapshots/3gpp-27007.md",
  "commands_total": 13,
  "implemented_full": 9,
  "implemented_stub": 4,
  "unsupported_declared": 0,
  "not_applicable": 0,
  "unknown": 0,
  "commands": [
    {"command": "+CREG", "status": "implemented_full", "handler": "CellularHandler"},
    {"command": "+CGREG", "status": "implemented_stub", "handler": "CellularHandler"},
    {"command": "+CEREG", "status": "implemented_stub", "handler": "CellularHandler"},
    {"command": "+CSQ", "status": "implemented_full", "handler": "CellularHandler"},
    {"command": "+CPIN", "status": "implemented_full", "handler": "CellularHandler"},
    {"command": "+COPS", "status": "implemented_full", "handler": "CellularHandler"},
    {"command": "+CMEE", "status": "implemented_full", "handler": "CellularHandler"},
    {"command": "+CGMI", "status": "implemented_full", "handler": "CellularHandler"},
    {"command": "+CGMM", "status": "implemented_full", "handler": "CellularHandler"},
    {"command": "+CGMR", "status": "implemented_full", "handler": "CellularHandler"},
    {"command": "+CGSN", "status": "implemented_full", "handler": "CellularHandler"},
    {"command": "+CCLK", "status": "implemented_stub", "handler": "CellularHandler"},
    {"command": "+CFUN", "status": "implemented_stub", "handler": "CellularHandler"}
  ]
}
