{
  "profile": "westermo-gdw11-6615-2220",
  "source": "references/snapshots/westermo-gdw11.md",
  "commands_total": 45,
  "implemented_full": 33,
  "implemented_stub": 7,
  "unsupported_declared": 5,
  "not_applicable": 0,
  "unknown": 0,
  "commands": [
    {"command": "AT", "status": "implemented_full", "handler": "HayesHandler"},
    {"command": "A/", "status": "implemented_full", "handler": "HayesHandler"},
    {"command": "+++", "status": "implemented_full", "handler": "HayesHandler"},
    {"command": "ATE", "status": "implemented_full", "handler": "HayesHandler"},
    {"command": "ATQ", "status": "implemented_full", "handler": "HayesHandler"},
    {"command": "ATV", "status": "implemented_full", "handler": "HayesHandler"},
    {"command": "ATZ", "status": "implemented_full", "handler": "HayesHandler"},
    {"command": "AT&F", "status": "implemented_full", "handler": "HayesHandler"},
    {"command": "AT&W", "status": "implemented_full", "handler": "HayesHandler"},
    {"command": "AT&V", "status": "implemented_full", "handler": "HayesHandler"},
    {"command": "AT&D", "status": "implemented_full", "handler": "HayesHandler"},
    {"command": "AT&C", "status": "implemented_full", "handler": "HayesHandler"},
    {"command": "ATA", "status": "implemented_full", "handler": "HayesHandler"},
    {"command": "ATD", "status": "implemented_stub", "handler": "HayesHandler"},
    {"command": "ATH", "status": "implemented_full", "handler": "HayesHandler"},
    {"command": "ATO", "status": "implemented_full", "handler": "HayesHandler"},
    {"command": "ATS", "status": "implemented_full", "handler": "HayesHandler"},
    {"command": "ATI", "status": "implemented_full", "handler": "HayesHandler"},
    {"command": "+CGMI", "status": "implemented_full", "handler": "CellularHandler"},
    {"command": "+CGMM", "status": "implemented_full", "handler": "CellularHandler"},
    {"command": "+CGMR", "status": "implemented_full", "handler": "CellularHandler"},
    {"command": "+CGSN", "status": "implemented_full", "handler": "CellularHandler"},
    {"command": "+CPIN", "status": "implemented_full", "handler": "CellularHandler"},
    {"command": "+CMEE", "status": "implemented_full", "handler": "CellularHandler"},
    {"command": "+CREG", "status": "implemented_full", "handler": "CellularHandler"},
    {"command": "+CGREG", "status": "implemented_stub", "handler": "CellularHandler"},
    {"command": "+CEREG", "status": "implemented_stub", "handler": "CellularHandler"},
    {"command": "+CSQ", "status": "implemented_full", "handler": "CellularHandler"},
    {"command": "+COPS", "status": "implemented_full", "handler": "CellularHandler"},
    {"command": "+CCLK", "status": "implemented_stub", "handler": "CellularHandler"},
    {"command": "+CFUN", "status": "implemented_stub", "handler": "CellularHandler"},
    {"command": "+CMGF", "status": "implemented_full", "handler": "SmsHandler"},
    {"command": "+CMGS", "status": "implemented_full", "handler": "SmsHandler"},
    {"command": "+CMGR", "status": "implemented_full", "handler": "SmsHandler"},
    {"command": "+CMGL", "status": "implemented_full", "handler": "SmsHandler"},
    {"command": "+CMGD", "status": "implemented_full", "handler": "SmsHandler"},
    {"command": "+CNMI", "status": "implemented_stub", "handler": "SmsHandler"},
    {"command": "+CPMS", "status": "implemented_full", "handler": "SmsHandler"},
    {"command": "+CSCA", "status": "implemented_full", "handler": "SmsHandler"},
    {"command": "+CSCS", "status": "implemented_stub", "handler": "SmsHandler"},
    {"command": "+WIND", "status": "unsupported_declared", "reason": "Westermo/Wavecom indication control is tracked but out of v0.2 runtime scope"},
    {"command": "+WIOR", "status": "unsupported_declared", "reason": "Westermo/Wavecom GPIO read is tracked but out of v0.2 runtime scope"},
    {"command": "+WIOW", "status": "unsupported_declared", "reason": "Westermo/Wavecom GPIO write is tracked but out of v0.2 runtime scope"},
    {"command": "+STSF", "status": "unsupported_declared", "reason": "SIM toolkit configuration is tracked but out of v0.2 runtime scope"},
    {"command": "+CCED", "status": "unsupported_declared", "reason": "Cell environment diagnostics are tracked but out of v0.2 runtime scope"}
  ]
}
