{
  "profile": "westermo-td36-6618-2202",
  "source": "references/snapshots/westermo-td36.md",
  "commands_total": 17,
  "implemented_full": 16,
  "implemented_stub": 1,
  "unsupported_declared": 0,
  "not_applicable": 0,
  "unknown": 0,
  "commands": [
    {"command": "AT", "status": "implemented_full", "handler": "HayesHandler"},
    {"command": "A/", "status": "implemented_full", "handler": "HayesHandler"},
    {"command": "+++", "status": "implemented_full", "handler": "HayesHandler"},
    {"command": "ATE", "status": "implemented_full", "handler": "HayesHandler"},
    {"command": "ATQ", "status": "implemented_full", "handler": "HayesHandler"},
    {"command": "ATV", "status": "implemented_full", "handler": "HayesHandler"},
    {"command": "ATZ", "status": "implemented_full", "handler": "HayesHandler"},
    {"command": "AT&F", "status": "implemented_full", "handler": "HayesHandler"},
    {"command": "AT&W", "status": "implemented_full", "handler": "HayesHandler"},
    {"command": "AT&V", "status": "implemented_full", "handler": "HayesHandler"},
    {"command": "AT&D", "status": "implemented_full", "handler": "HayesHandler"},
    {"command": "AT&C", "status": "implemented_full", "handler": "HayesHandler"},
    {"command": "ATD", "status": "implemented_stub", "handler": "HayesHandler"},
    {"command": "ATH", "status": "implemented_full", "handler": "HayesHandler"},
    {"command": "ATO", "status": "implemented_full", "handler": "HayesHandler"},
    {"command": "ATS", "status": "implemented_full", "handler": "HayesHandler"},
    {"command": "ATI", "status": "implemented_full", "handler": "HayesHandler"}
  ]
}
